{
  "$schema": "https://json-schema.org/draft/2020-12/schema",
  "title": "ProducerChange Schema",
  "description": "Schema for producer changes in Producerflow",
  "type": "object",
  "properties": {
    "id": {
      "type": "string",
      "minLength": 1,
      "description": "Unique identifier for the change"
    },
    "event_type": {
      "type": "string",
      "minLength": 1,
      "description": "Type of event that occurred (e.g., 'producer.created', 'producer.updated', 'producer.transferred')"
    },
    "origin": {
      "type": "string",
      "enum": ["ProducerFlowAPI", "ProducerFlowPortal", "NIPR"],
      "description": "Source of the change"
    },
    "timestamp": {
      "type": "string",
      "format": "date-time",
      "description": "When the change occurred"
    },
    "producer_id": {
      "type": "string",
      "minLength": 1,
      "description": "Always present. Unique identifier for the producer"
    },
    "external_id": {
      "type": "string",
      "description": "Only present if filled in by tenant. External identifier for the producer"
    },
    "agency_id": {
      "type": "string",
      "minLength": 1,
      "description": "Always present. ID of the agency that the producer belongs to. For 'producer.transferred', this is the TARGET (new) agency"
    },
    "external_agency_id": {
      "type": "string",
      "description": "Only present if filled in by tenant. External ID of the agency that the producer belongs to. For 'producer.transferred', this is the target agency's external ID"
    },
    "transfer_id": {
      "type": "string",
      "description": "Present only for 'producer.transferred'. Unique identifier of the transfer"
    },
    "source_agency_id": {
      "type": "string",
      "description": "Present only for 'producer.transferred'. ID of the agency the producer was transferred FROM"
    },
    "external_source_agency_id": {
      "type": "string",
      "description": "Present only for 'producer.transferred', when filled in by tenant. External ID of the source agency"
    },
    "npn": {
      "type": "string",
      "minLength": 1,
      "description": "Always present. National Producer Number"
    },
    "accurate_background_check": {
      "type": "object",
      "description": "Present when producer background check is added or updated. Contains background check information",
      "properties": {
        "accurate_order_id": {
          "type": "string"
        },
        "background_check_passed": {
          "type": "boolean"
        },
        "background_check_timestamp": {
          "type": "string"
        }
      }
    },
    "producer_data": {
      "type": "object",
      "description": "Present when producer is created or when any producer data field (city, email, first_name, last_name, middle_name, phone, state, street, address_line_2, zip, is_sole_proprietor) is updated. Contains the producer's personal and contact information",
      "properties": {
        "city": { "type": "string" },
        "email": { "type": "string" },
        "first_name": { "type": "string" },
        "last_name": { "type": "string" },
        "middle_name": { "type": "string" },
        "phone": { "type": "string" },
        "state": { "type": "string" },
        "street": { "type": "string" },
        "address_line_2": { "type": "string" },
        "zip": { "type": "string" },
        "is_sole_proprietor": {
          "type": "boolean",
          "description": "Whether the producer is a sole proprietor"
        },
        "is_principal": {
          "type": "boolean",
          "description": "Whether the producer is the principal/lead agent of the agency"
        }
      }
    },
    "producer_nipr_data": {
      "type": "object",
      "description": "Present when NIPR data is synced for the producer. Contains producer information from NIPR",
      "properties": {
        "birth_date": { "type": "string", "format": "date" },
        "business_email": { "type": "string" },
        "business_phone": { "type": "string" },
        "first_name": { "type": "string" },
        "last_name": { "type": "string" },
        "middle_name": { "type": "string" },
        "suffix": { "type": "string" }
      }
    },
    "producer_nipr_appointments": {
      "type": "array",
      "description": "Present when NIPR data is synced for the producer. Contains all current carrier appointments from NIPR",
      "items": {
        "type": "object",
        "properties": {
          "carrier_code": { "type": "string" },
          "carrier_fein": { "type": "string" },
          "company_name": { "type": "string" },
          "loa": { "type": "string" },
          "loa_code": { "type": "string" },
          "state": { "type": "string" },
          "status": { "type": "string" },
          "termination_reason": { "type": "string" },
          "status_reason_date": { "type": "string", "format": "date" },
          "renewal_date": { "type": "string", "format": "date" }
        }
      }
    },
    "producer_nipr_licenses": {
      "type": "array",
      "description": "Present when NIPR data is synced for the producer. Contains all current licenses with their LOAs from NIPR",
      "items": {
        "type": "object",
        "properties": {
          "license_id": {
            "type": "string",
            "format": "string",
            "description": "Unique identifier for the license"
          },
          "expiration_date": { "type": "string", "format": "date" },
          "is_active": { "type": "boolean" },
          "issue_date": { "type": "string", "format": "date" },
          "license_class": { "type": "string" },
          "license_class_code": { "type": "string" },
          "npn": { "type": "string" },
          "license_number": { "type": "string" },
          "residency_status": { "type": "string" },
          "designated_home_state": { "type": "string" },
          "license_state": { "type": "string" },
          "loas": {
            "type": "array",
            "items": {
              "type": "object",
              "properties": {
                "loa": { "type": "string" },
                "loa_code": { "type": "string" },
                "is_active": { "type": "boolean" },
                "status_reason": { "type": "string" },
                "issue_date": { "type": "string", "format": "date" },
                "status_reason_date": { "type": "string", "format": "date" },
                "ce_compliance": { "type": "string" },
                "ce_renewal_date": { "type": "string", "format": "date" },
                "ce_credits_needed": { "type": "string" }
              }
            }
          }
        }
      }
    },
    "producer_nipr_addresses": {
      "type": "array",
      "description": "Present when NIPR data is synced for the producer. Contains all addresses from NIPR",
      "items": {
        "type": "object",
        "properties": {
          "address_type": { "type": "string" },
          "city": { "type": "string" },
          "country": { "type": "string" },
          "state": { "type": "string" },
          "street": { "type": "string" },
          "zip_code": { "type": "string" }
        }
      }
    },
    "producer_nipr_regulatory_actions": {
      "type": "array",
      "description": "Present when NIPR data is synced for the producer. Contains all regulatory actions from NIPR",
      "items": {
        "type": "object",
        "properties": {
          "state": { "type": "string" },
          "reason_for_action": { "type": "string" },
          "disposition": { "type": "string" },
          "date_of_action": { "type": "string", "format": "date" },
          "effective_date": { "type": "string", "format": "date" },
          "enter_date": { "type": "string", "format": "date" },
          "file_reference": { "type": "string" },
          "penalty_fine_forfeiture": { "type": "string" },
          "length_of_order": { "type": "string" },
          "origin_of_action": { "type": "string" }
        }
      }
    },
    "requested_appointment_states": {
      "type": "array",
      "description": "Present when producer is created or when the requested appointment states are updated. Contains the list of US state codes where appointments are requested. When present, this field is always an array (never null); an empty array indicates all requested states have been cleared",
      "items": {
        "type": "string"
      }
    },
    "nipr_sync_status": {
      "type": "string",
      "enum": ["active", "failing", "pending", "disabled"],
      "description": "Always present. NIPR synchronization status of the producer (disabled, pending, failing, active)"
    },
    "nipr_sync_status_updated_at": {
      "type": "string",
      "format": "date-time",
      "description": "Always present. ISO 8601 timestamp when the NIPR synchronization status was last updated"
    },
    "organization": {
      "type": "object",
      "description": "Present when the producer's agency organization assignment changes. Contains organization details",
      "properties": {
        "organization_id": {
          "type": "string",
          "description": "Unique internal identifier for the organization"
        },
        "name": {
          "type": "string",
          "description": "Display name of the organization"
        },
        "external_id": {
          "type": "string",
          "description": "Always present if filled in by tenant. External identifier for the organization from an external system"
        },
        "email": {
          "type": "string",
          "description": "Contact email address for the organization"
        }
      }
    },
    "metadata_questions": {
      "type": "string",
      "description": "Deprecated: Use tenant_additional_questions instead. Custom metadata questions and answers in JSON string format. This field will be removed in a future release."
    },
    "tenant_additional_questions": {
      "type": "object",
      "description": "Present when the tenant_additional_questions field changes. An empty object ({}) means the field was cleared; absent means the field was not changed in this event. Contains custom additional questions and answers as key-value pairs collected during producer onboarding",
      "additionalProperties": {
        "type": "string"
      }
    },
    "external_metadata": {
      "type": "object",
      "description": "Present when the external_metadata field changes. An empty object ({}) means the field was cleared; absent means the field was not changed in this event. Contains tenant-specific metadata as key-value pairs allowing tenants to attach their own business attributes, computed values, or derived data to producers",
      "additionalProperties": {
        "type": "string"
      }
    },
    "assigned_locations": {
      "type": "array",
      "description": "Present when producer location assignments change. Contains locations assigned to the producer. When a location is unassigned, it will be included in the array with unassigned=true along with all remaining assigned locations.",
      "items": {
        "type": "object",
        "properties": {
          "location_id": {
            "type": "string",
            "description": "Unique identifier for the location"
          },
          "name": {
            "type": "string",
            "description": "Name of the location"
          },
          "street": {
            "type": "string",
            "description": "Street address"
          },
          "address_line_2": {
            "type": "string",
            "description": "Second line of the street address (e.g., apartment, suite, unit number)"
          },
          "city": {
            "type": "string",
            "description": "City"
          },
          "state": {
            "type": "string",
            "description": "State or province"
          },
          "zip": {
            "type": "string",
            "description": "Postal code"
          },
          "phone": {
            "type": "string",
            "description": "Contact phone number for this location"
          },
          "email": {
            "type": "string",
            "format": "email",
            "description": "Contact email for this location"
          },
          "is_primary": {
            "type": "boolean",
            "description": "Whether this is the primary location for the producer"
          },
          "unassigned": {
            "type": "boolean",
            "description": "When true, indicates this location has been unassigned from the producer. This follows the same pattern as organization unassignment."
          }
        }
      }
    },
    "contract_status": {
      "type": "string",
      "enum": ["unsigned", "sent", "signed", "failed"],
      "description": "Present when producer contract status changes. Current status of the producer's contract"
    },
    "onboarding_status": {
      "type": "string",
      "enum": ["ONBOARDING_STATUS_ONBOARDED", "ONBOARDING_STATUS_APPROVED", "ONBOARDING_STATUS_READY_TO_QUOTE", "ONBOARDING_STATUS_TERMINATED"],
      "description": "Present when producer onboarding status changes. Tracks the producer's progress through the onboarding workflow"
    },
    "onboarding_status_updated_at": {
      "type": "string",
      "format": "date-time",
      "description": "Present when producer onboarding status changes. ISO 8601 timestamp when the onboarding status was last updated"
    }
  },
  "required": ["id", "event_type", "origin", "timestamp", "producer_id", "agency_id", "npn"],
  "additionalProperties": false
}
